index,album,song,lyrics
20,hotpink,sayso,day to night to morning, keep with me in the moment|-|i'd let you had i known it, why don't you say so?|-|didn't even notice, no punches left to roll with|-|you got to keep me focused. you want it? say so|-|day to night to morning, keep with me in the moment|-|i'd let you had i known it, why don't you say so?|-|didn't even notice, no punches left to roll with|-|you got to keep me focused. you want it? say so|-|it's been a long time since you fell in love|-|you ain't coming out your shell, you ain't really been yourself|-|tell me, what must i do? do tell my love|-|'cause luckily i'm good at reading|-|i wouldn't bug him, but he won't stop cheesin'|-|and we can dance all day around it|-|if you front, then i'll be bouncing|-|if you want it, scream it, shout it, babe|-|before i leave you dry|-|day to night to morning, keep with me in the moment|-|i'd let you had i known it, why don't you say so?|-|didn't even notice, no punches left to roll with|-|you got to keep me focused. you want it? say so|-|day to night to morning, keep with me in the moment|-|i'd let you had i known it, why don't you say so?|-|didn't even notice, no punches left to roll with|-|you got to keep me focused. you want it? say so (yeah)|-|let me check my chest, my breath right quick (ha)|-|he ain't never seen it in a dress like this (ah)|-|he ain't never even been impressed like this|-|prolly why i got him quiet on the set like zip|-|like it, love it, need it, bad|-|take it, own it, steal it, fast|-|boy, stop playing, grab my ass|-|why you actin' like you shy?|-|shut it, save it, keep it, push|-|why you beating 'round the bush?|-|knowing you want all this woman|-|never knock it 'til you try (yah, yah)|-|all of them bitches hating i have you with me|-|all of my niggas saying you mad committed|-|realer than anybody you had, and pretty|-|all of that body-ody the ass and titties|-|day to night to morning, keep with me in the moment|-|i'd let you had i known it, why don't you say so?|-|didn't even notice, no punches left to roll with|-|you got to keep me focused. you want it? say so|-|day to night to morning, keep with me in the moment|-|i'd let you had i known it, why don't you say so?|-|didn't even notice, no punches left to roll with|-|you got to keep me focused. you want it? say so
21,hotpink,likethat,cállate, mike crook|-|burr, burr|-|gucci (don\'t stop)|-|doja, gato|-|yeah (don\'t stop)|-|tha-tha-tha-tha-tha-that\'s my shit, that\'s my way|-|do it like that and i\'ll repay it|-|don\'t be scared, i ain\'t afraid|-|just like that, come my way|-|that\'s my shit, that\'s my way|-|do it like that and i\'ll repay it|-|don\'t be scared, i ain\'t afraid|-|just like that, come my way (yeah)|-|i said, "do that, do that, baby, all night long"|-|and i\'ma turn off all my phones|-|you know i hate it when i\'m left on read|-|but he make it all up in the bed|-|and he take me out, dinin\' on nothin\' but the best|-|he got off-white on right, damn, he can dress|-|makin\' plans from the east, makin\' bands in the west|-|rock star, black beatle type, bands on his bread|-|and baby, i want it, and i\'ll just be honest|-|\'cause i just can\'t front when i look at you|-|just keep it one hundred, when i throw these hundreds|-|i hope that your ass gon\' know what to do|-|tha-tha-tha-tha-tha-that\'s my shit, that\'s my way|-|do it like that and i\'ll repay it|-|don\'t be scared, i ain\'t afraid|-|just like that, come my way|-|that\'s my shit, that\'s my way|-|do it like that and i\'ll repay it (huh?)|-|don\'t be scared, i ain\'t afraid (wop)|-|just like that, come my way|-|gucci el dorado, we in rome, i\'m a model (rome)|-|gucci mane and doja cat, call me el gato (gato)|-|i\'m the big boss and i got big bread (yeah)|-|i\'m gettin\' big-headed and i like good head (shh)|-|i\'m not cheap, baby, and i\'m sure not selfish (no)|-|shakin\' like elvis, damn near broke my pelvis (sheesh)|-|jumpin\' off the top rope, got \'em tag teamin\' (tag)|-|putting on a show, i got the whole crowd screamin\'|-|bougie with the bread, i\'ll knock a top-notch freak (freak)|-|act like i\'m a treat when a dog see me (rr)|-|like a thief in the night, just like she stole my green|-|got me walkin\' off the scene like a hole in my jeans (damn, gucci)|-|tha-tha-tha-tha-tha-tha-that\'s my shit, that\'s my way (yeah)|-|do it like that and i\'ll repay it (huh?)|-|don\'t be scared, i ain\'t afraid (huh?)|-|just like that, come my way (burr)|-|that\'s my shit, that\'s my way|-|do it like that and i\'ll repay it|-|don\'t be scared, i ain\'t afraid|-|just like that, come my way|-|said i like it|-|i like it|-|i like it|-|i like it like that|-|said i like it|-|i like it (ooh)|-|i like it|-|i like it like that|-|tha-tha-tha-tha-tha-that\'s my shit
22,hotpink,talkdirty,talk, talking to ya|-|see, baby, when i'm talk, talking to ya|-|baby, when i’m talk, talking to ya|-|baby, when i'm talk, talking to ya|-|(yeah, yeah, when you, ayy, when you, when you talk dirty back)|-|now, when you talk like that (when you talk to me), i be in my bag|-|i be in my bag, now, baby, i'm all in my bag (when you talk dirty back)|-|now, when you talk like that (when you talk to me), i be in my bag|-|i be in my bag, now, baby, i’m all in my bag (when you talk dirty back)|-|now, when you talk like that (when you talk to me), i be in my bag|-|i be in my bag (when you talk to me), now, baby, i'm all in my bag (when you talk dirty back)|-|now, when you talk like that (when you talk to me), i be in my bag|-|i be in my bag (when you talk to me), now, baby, i'm all in my bag (when you talk dirty back)|-|said when you talk like that, put that shit to work|-|make that kitty hurt, make that kitty squirt|-|tell me what's my name, make that kitty yearn|-|teach me how to jerk, make that kitty learn|-|uh, wait, who's your mama? who's your daddy, lil' babe?|-|he want a baddie, he want skinny with a fatty, um, waist|-|tell me how much you just want my body on you, babe|-|like the way you say it's yummy when i’m grindin’ on your face|-|grindin' on your, wait, grindin’ on your face|-|like the way you say it's yummy when i'm grindin' on your|-|gri-gri-grindin’ on your face, ayy, grindin' on your face|-|i like the way you say it's yummy when i'm grindin' on your face (when you talk dirty back)|-|talk like that (when you talk to me), i be in my bag|-|i be in my bag, now, baby, i'm all in my bag (when you talk dirty back)|-|now, when you talk like that (when you talk to me), i be in my bag|-|i be in my bag, now, baby, i'm all in my bag (when you talk dirty back)|-|now, when you talk like that (when you talk to me), i be in my bag|-|i be in my bag (when you talk to me), now, baby, i'm all in my bag (when you talk dirty back)|-|now, when you talk like that (when you talk to me), i be in my bag|-|i be in my bag (when you talk to me), now, baby, i'm all in my bag (when you talk dirty back)|-|and i say hey, i don't know the way, i|-|don't know just how to say what's been all in my head, i|-|just wanna let you in 'cause i know you got good taste, and|-|i love the way you taste, boy, tell me what you think, i|-|i, i, i|-|and i know you want me, now you got me|-|don't you play with it, get naughty|-|call you daddy, you call me mami|-|you so crazy when you taunt me (yeah)|-|and i say, yeah, talk like that|-|all up in my ear when he want that wax|-|funny how the earrings are all intact|-|can't even hear when i moan like that|-|aw yeah, that's your fault|-|with a lil' serious tone in fact|-|grab my hair with the eye contact|-|phone sex good, that's why i phone back, uh|-|and you know that i pick up right when you call me|-|got your voice in my head, it's making me horny|-|and i can't ever wake you up in the morning|-|you know once they there, they ain't gonna be lonely|-|talk like that (when you talk to me), i be in my bag|-|i be in my bag, now, baby, i'm all in my bag (when you talk dirty back)|-|now, when you talk like that (when you talk to me), i be in my bag|-|i be in my bag, now, baby, i'm all in my bag (when you talk dirty back)|-|now, when you talk like that (when you talk to me), i be in my bag|-|i be in my bag (when you talk to me), now, baby, i'm all in my bag (when you talk dirty back)|-|now, when you talk like that (when you talk to me), i be in my bag|-|i be in my bag (when you talk to me), now, baby, i'm all in my bag (when you talk dirty)|-|will you talk to me?|-|you must have it in you, i just like the way you think|-|i'm open if you are, you know what it's gon' be|-|whisper to my soul, boy, i just like the way you speak|-|talk, talking to ya|-|see baby, when i'm talk, talking to ya|-|baby, when i'm talk, talking to ya|-|baby, when i'm talk, talking to ya
23,hotpink,addiction,it's doja|-|i don't know how else to tell you this, but|-|i got one way, maybe this'll work|-|you just gotta listen closely to me|-|i need you, me, us|-|addicted, uh|-|i am addicted, a little|-|under the influence, a little|-|and it makes me want to dance, a little|-|an itch i just can't scratch, addiction|-|i got such a pretty body|-|feels prettier when i'm a mess|-|and i just like to call him daddy|-|'cause the first one had up and left|-|and you can relate to broken girls|-|i've been a day without it, i'm proud of myself|-|baby, can you break the curse?|-|i'm so gone, i believe in magic|-|you can relate to broken girls|-|i've been a day without it, i'm proud of myself|-|baby, can you break the curse?|-|i'm so gone, i believe in magic|-|i am addicted, a little|-|under the influence, a little|-|and it makes me want to dance, a little|-|an itch i just can't scratch, addiction|-|look|-|i'm just a little bit, i'm just a little bit (oh na na na, na, na, na na)|-|i'm just a little bit, i'm just a little bit|-|i'm just a little bit, i'm just a little bit (oh na na na, na, na, na na)|-|i'm just a little bit, i'm just a little bit|-|more, just a little bit more, just a little bit (oh na na na, na, na, na na)|-|more, just a little bit more, just a little bit|-|more, just a little bit more, just a little bit (oh na na na, na, na, na na)|-|more, just a little bit more, just a little bit|-|yeah, roll another hunnid|-|we could get that white girl lit like madonna|-|bitch, i ain't gwen, but this shit is bananas|-|sweating, make ya whole body drip like a sauna|-|swim like your piranha, put m's in my water|-|i can't feel my lips, my limbs feel like rubber|-|yeah, i came down, but i still need another|-|one under the tongue and then a little marijuana|-|they on the trees like koala|-|i am addicted, a little|-|under the influence, a little|-|and it makes me want to dance, a little|-|an itch i just can't scratch, addiction|-|look|-|i'm just a little bit, i'm just a little bit (oh na na na, na, na, na na)|-|i'm just a little bit, i'm just a little bit|-|i'm just a little bit, i'm just a little bit (oh na na na, na, na, na na)|-|i'm just a little bit, i'm just a little bit|-|more, just a little bit more, just a little bit (oh na na na, na, na, na na)|-|more, just a little bit more, just a little bit|-|more, just a little bit more, just a little bit (oh na na na, na, na, na na)|-|more, just a little bit more, just a little bit
24,hotpink,streets,i've been goin' through some things (oh)|-|i struggle with my inner man (yeah, yeah)|-|i hustle, i'll do what i can to get this money|-|blaq tuxedo|-|don dada on the, don dada on the beat|-|like you, like you|-|like you, ooh|-|i found it hard to find someone like you|-|like you, like you|-|send your location, come through|-|i can't sleep no more|-|in my head, we belong|-|and i can't be without you|-|why can't i find no one like you?|-|i can't sleep no more|-|in my head, we belong|-|and i can't be without you|-|why can't i find no one like you?|-|baby, we tried to fight it|-|we all been there some days|-|thought i needed something else|-|and acted like i was okay|-|we just had to work it out|-|and baby, i needed space|-|ain't nobody 'round here on your level|-|you're so far away|-|you're pouring your heart out|-|i'm acting like i knew|-|you held me so down|-|so down i never grew up|-|i tried to find out|-|when none of them came through|-|and now i'm stuck in the middle|-|and baby had to pull me out, oh|-|like you, like you|-|like you, ooh|-|i found it hard to find someone like you|-|like you, like you|-|send your location, come through (yeah)|-|damn papa, you a rare breed, no comparing|-|and it's motherfuckin' scary|-|tryna keep him 'cause i found him|-|let a ho know i ain't motherfuckin' sharing|-|i could take you to the parents, then to paris|-|plan a motherfuckin' wedding|-|you the type i wanna marry (yeah) and keep you merry|-|i'll put the ring on when you ready|-|we play our fantasies out in real life ways and|-|no final fantasy, can we end these games though?|-|you give me energy, make me feel lightweight|-|like the birds of a feather, baby|-|we real life made for each other|-|and it's hard to keep my cool|-|when other bitches tryna get with my dude and|-|when other chickens tryna get in my coop|-|'cause you're a one in a million|-|there ain't no man like you|-|like you, like you|-|like you, ooh|-|i found it hard to find someone like you|-|like you, like you|-|send your location, come through|-|i can't sleep no more|-|in my head, we belong|-|and i can't be without you|-|why can't i find no one like you?|-|i can't sleep no more|-|in my head, we belong|-|and i can't be without you|-|why can't i find no one like you?
25,hotpink,shine,ruby red, bright, bright|-|diamonds on shine, should be legally blind|-|the smile pearl white, white|-|diamonds on shine, if i ever can find \'em (shine)|-|dun-dun, d-dun, d-dun-dun-dun-dun (shine bright)|-|dun-dun, d-dun, d-dun-dun-dun (shine)|-|d-d-dun-dun, d-dun, d-dun, d-d-dun-dun (shine bright)|-|dun-dun, d-dun, d-dun, d-d-dun-dun (shine)|-|diamonds on shine and they are mine|-|yeah, i fuck your mind, i ain\'t got time|-|dick was hella mean, slipped in some nice|-|skating on my rings, slipped on some ice|-|tryna live like me, bitch won\'t survive|-|she ain\'t got the juice, this won\'t suffice|-|you know who your queen, it\'s no surprise|-|it\'s no mystery, bitch, fall in line|-|yeah, turnin\' off the lights, they go, "oowee, that\'s tight"|-|slept the whole way, that\'s a boujee ass flight|-|spent a hundred k on that coochie last night|-|i said, "spank you very much, that booty ruby red, bright, light"|-|ruby red, bright, bright|-|diamonds on shine, should be legally blind|-|the smile pearl white, white|-|diamonds on shine, if i ever can find \'em (shine)|-|dun-dun, d-dun, d-dun-dun-dun-dun (shine bright)|-|dun-dun, d-dun, d-dun-dun-dun (shine)|-|d-d-dun-dun, d-dun, d-dun, d-d-dun-dun (shine bright)|-|dun-dun, d-dun, d-dun, d-d-dun-dun (shine)|-|what\'s that drippin\'? no, baby, i\'m not cryin\'|-|baby, that\'s my diamonds, everything so vibrant|-|say it like i mean it and i says it like i\'m simon|-|i read her like she fine print, and beat her without violence|-|when it\'s heavy on me, it\'s like a brick on my ring, yeah|-|baby on me, \'cause i got red in my genes, uh|-|work \'til i cry, bitch, i ain\'t barely got sleep|-|kept the ice on my grill for me to get all of this heat|-|ruby red, bright, bright|-|diamonds on shine, should be legally blind|-|the smile pearl white, white|-|diamonds on shine, if i ever can find \'em (shine)|-|dun-dun, d-dun, d-dun-dun-dun-dun (shine bright)|-|dun-dun, d-dun, d-dun-dun-dun (shine)|-|d-d-dun-dun, d-dun, d-dun, d-d-dun-dun (shine bright)|-|dun-dun, d-dun, d-dun, d-d-dun-dun (shine)|-|shine
26,hotpink,betterthanme,better than me|-|all of them bitches ain't better than me|-|i know you wanted somethin' else that you freak|-|you go thinkin' how you lost one and that's me (yeah, yeah)|-|better than me|-|she ain't no queen, i'm like houdini|-|put a little magic in you like they can't see me|-|she so thickie in that polka-dotted bikini|-|baby, why you frontin'? you know that i been the best|-|i come for they neck, they run 'cause i'm next|-|you so in denial lately she just got you stressed|-|she got no finesse, she just get undressed|-|yuh (yuh), talk (yuh)|-|put the honey in the pot (pot)|-|put a nigga in his place|-|she don't wanna take my spot|-|whoa (whoa), whoa (whoa)|-|she ain't even got my guap (whoa)|-|she ain't got a lot to say (say)|-|even if she bring that talk|-|better than me, better than me|-|the best pussy, come from wifey|-|better than me|-|all of them bitches ain't better than me|-|i know you wanted somethin' else that you freak|-|you go thinkin' how you lost one and that's me |-|look, i can do that too, bitch, i can do that too|-|i can get him juiced, i can make him screw, and|-|trust me, he wake up right in the mornin', or like two, and|-|just to get a smooch, and, touch on that caboose, and|-|what they say about it? oh, they say either you snoozin'|-|honey, you just lose him, why the fuck he snoozin'?|-|messin' with my man, shawty, you cruisin' for a bruisin'|-|don't gotta be slimy, honey, swag is what i'm oozin'|-|and they call her a trick because all she got is illusions|-|we walk in the room and complement each other smoothly|-|'member how i kissed you upside down, like in that movie|-|let god be the judge and we can get rid of these judas|-|better than me (better than me), better than me (she ain't better than me, baby)|-|the best pussy (best pussy), come from wifey (come from wifey)|-|better than me (none of the bitches)|-|all of them bitches ain't better than me|-|i know you wanted somethin' else that you freak|-|you go thinkin' how you lost more and lost me|-|you go thinkin' how you lost one and that's me (yeah, yeah)|-|you gon' figure out, baby|-|careful who you fuckin' with, 'cause you just lost one|-|just be careful who you fuckin' with, 'cause you just lost one
27,hotpink,juicyremix,i keep it juicy juicy, i eat that lunch (yeah)|-|she keep that booty booty, she keep that plump (yeah yeah)|-|that natural beauty beauty, yeah, yeah|-|if you could see it from the front, wait till you see it from the back, back, back, back, back|-|(wait till you see it from the...)|-|back, back, yeah, back, back, back (wait till you see it from the...)|-|back, back, back, back, back (wait till you see it from the...)|-|if you could see it from the front, wait till you see it from the back|-|he like the doja and the cat, yeah|-|he like it thicc, he like it fat, yeah|-|like to keep him wanting more|-|he ask me, "doja, where you at, huh?"|-|and all them niggas wanna know|-|how long it take to pull my pants up, mmh, mmh, mmh|-|broke a fingernail and then some, mmh|-|tryna squeeze into my true religion denim, mmh, mmh, mmh|-|sell it big, don\'t wanna sell you light (yeah, i don\'t wanna sell it)|-|i don\'t buy it, where the cellulite?|-|he said the body unbelievable|-|can\'t trust a big butt and a gemini|-|i keep it juicy juicy, i eat that lunch (yeah)|-|she keep that booty booty, she keep that plump (yeah yeah)|-|that natural beauty beauty, yeah, yeah|-|if you could see it from the front, wait till you see it from the back, back, back, back, back|-|(wait till you see it from the...)|-|back, back, yeah, back, back, back (wait till you see it from the...)|-|back, back, yeah, back, back, back (wait till you see it from the...)|-|if you could see it from the front, wait till you see it from the back|-|bring that ass over, doja, bring it back, back, back|-|i\'m a big dog tryna eat the kitty cat, cat|-|i\'ma slide in, the way it fit, i can tell we match|-|all about my racks, hella cheese, i don\'t fuck with rats|-|big crib in hollywood, i don\'t even act|-|calm, relaxed, let a nigga tap, hit you on the app|-|take a little, with the, wipe the pain away|-|juicy and it\'s tighter than a virgin like madonna say|-|i love when you give in, i love when you don\'t (sometimes)|-|hit me with the threesome and sometimes you won\'t (sometimes)|-|you told me don\'t fuck with no bitches you know (naw)|-|you got it, yeah, you got it, baby, bust it on the floor|-|i keep it juicy juicy, i eat that lunch (yeah)|-|she keep that booty booty, she keep that plump (yeah yeah)|-|that natural beauty beauty, yeah, yeah|-|if you could see it from the front, wait till you see it from the back, back, back, back, back|-|(wait till you see it from the...)|-|back, back, yeah, back, back, back (wait till you see it from the...)|-|back, back, yeah, back, back, back (wait till you see it from the...)|-|if you could see it from the front, wait till you see it from the back|-|yeah, he like it plump, he need that|-|need the rump and need the thighs, he eat that|-|eat that up, and in the night, he see that|-|in the dark, and in the ride he keep that|-|keep it running, like it plump, he need that|-|need the rump and need the thighs, he eat that|-|eat that up and in the night, he see that|-|in the dark, and in the ride he keep that|-|keep it running|-|i keep it juicy juicy, i eat that lunch (yeah)|-|she keep that booty booty, she keep that plump (yeah yeah)|-|that natural beauty beauty, yeah, yeah|-|if you could see it from the front, wait \'til you see it from the back, back, back, back, back|-|(wait till you see it from the...)|-|back, back, yeah, back, back, back (wait till you see it from the...)|-|back, back, yeah, back, back, back (wait till you see it from the...)|-|if you could see it from the front, wait till you see it from the back
28,planether,woman,hey, woman|-|hey, woman|-|woman|-|let me be your woman|-|woman, woman, woman (ayy)|-|i can be your woman|-|woman, woman, woman (ayy)|-|let me be your woman|-|woman, woman, woman (ayy)|-|i can be your woman|-|woman, woman, woman (ayy)|-|what you need?|-|she give tenfold, come here, papa, plant your seed|-|she can grow it from her womb, a family|-|provide lovin\' overlooked and unappreciated, you see (yeah)|-|you can reciprocate|-|i got delicious taste, you need a woman\'s touch in your place|-|just protect her and keep her safe|-|baby, worship my hips and waist|-|so feminine with grace|-|i touch your soul when you hear me say, "boy"|-|let me be your woman|-|woman|-|let me be your woman|-|woman, woman, woman|-|i can be your woman|-|woman, woman, woman|-|let me be your woman|-|woman, woman, woman (ayy)|-|i can be your woman|-|woman, woman, woman|-|i can be your lady, i\'m a woman|-|i\'m a motherfucker, but they got a problem|-|put some babies in your life and take away the drama|-|put that paper in the picture like a diorama|-|gotta face a lot of people of the opposite|-|\'cause the world told me, "we ain\'t got the common sense"|-|gotta prove it to myself that i\'m on top of shit|-|and you will never know a god without the goddesses|-|honest, it\'s fuckin\' honest, get|-|and i could be on everything|-|i mean i could be the leader, head of all the states|-|i could smile and jiggle it \'til his pockets empty|-|i could be the ceo, just look at robyn fenty|-|and i\'ma be there for you \'cause you on my team, girl|-|don\'t ever think you ain\'t hella these niggas dream girl|-|they wanna pit us against each other|-|when we succeedin\' for no reasons|-|they wanna see us end up like we regina on mean girls|-|princess or queen, tomboy or king (yeah)|-|you\'ve heard a lot, you\'ve never seen (nah)|-|mother earth, mother mary rise to the top|-|divine feminine, i\'m feminine (why?)|-|woman (daddy)|-|let me be your woman (let me be your—)|-|woman, woman, woman (let me be your—)|-|i can be your woman|-|woman, woman, woman (daddy)|-|let me be your woman (i know)|-|woman, woman, woman (daddy)|-|i can be your woman (i know)|-|woman, woman, woman|-|eee, eee, eee (hey, woman)|-|(woman)|-|eee, eee, eee (hey, woman)|-|hey (hey woman)|-|mm-hmm, mm-hmm (woman)|-|(hey, woman)|-|(hey, woman)
