index,album,song,lyrics
11,amala,bodylanguage,i think i need something new, something you got for me|-|i'm the one to give it to, to get into, i'm ready|-|i'ma get comfortable|-|'cause you know i won't be here all week|-|and we both got it in on freak|-|we ain't afraid of sexuality, oh|-|no games, no way, josé|-|foreplay, don't fake both ways|-|like olay, and i won't chase to it, oj|-|soul based, and i'm on face like i'm colgate|-|hallways when i go all day, get it (uh-huh)|-|now it's the one to throw it back with it|-|fittin' all that, he ain't gotta call back|-|trippin' this, prison this, nigga i don't get it, i'm addicted|-|reading all my feelings, need a one-way ticket|-|looking so fly 'cause i mind my business|-|self-proposed but you know i'm vicious|-|slow your roll, you can't lie to me, baby|-|i see it all in your eyes and your face|-|want these knees to go opposite ways|-|and i see you fiendin', go off on it, babe|-|i don't need to speak, i'm not talkin', babe|-|'cause you're talkin' with your body, body|-|can we touch up on that topic, topic?|-|you're coming on to me|-|and i can read it all up on your face|-|control it, get your way|-|baby, you can't hide from me|-|come and vibe with me|-|boy, it ain't my fault, it's building up inside of me|-|i hope i can get you out before you say goodbye to me|-|and boy, it ain't my fault, it's building up inside of me|-|i hope i can get you out before you say goodbye to me|-|'cause you're talkin' with your body, body|-|can we touch up on that topic, topic?|-|good self control but you stickin' it out|-|a figure of mouth, don't wonder why you twistin' your loud|-|she twerkin' it out and wonder why they thirstier now|-|every night dodgin' broke niggas, curvin' 'em out|-|like every pipe got its own feelings lurkin' below|-|i mean, really? do you love me? is it certain, for sure?|-|i got money, nigga, know you gon' be hurt if i don't|-|but i got niggas in my city and my bitches is cold, so|-|tell me what you had in mind|-|watch it closely, we'll unwind|-|psychology of the mind|-|you do your job, i'll do mine|-|'cause the body doesn't lie|-|'cause you're talkin' with your body, body|-|can we touch up on that topic, topic?|-|'cause you're talkin' with your body, body|-|can we touch up on that topic, topic?|-|i think i need something new, something you got for me|-|i'm the one to give it to, to get into, i'm ready|-|i'ma get comfortable|-|'cause you know i won't be here all week|-|and we both got it in on freak|-|we ain't afraid of sexuality, oh
12,amala,allnighter,et me break it to you boy|-|i can give it to you all night|-|on and on we pullin' all nighters|-|we ain't gotta turn on them lights|-|we up till the day break off|-|makeup, wanna take take off|-|no sleep, you my sunshine though|-|just me you and some wine|-|cuz we tryna unwind|-|we sleep maybe sometime|-|yeah we got the same schedule, sexual|-|drive speed so i just let you|-|spend fifteen on it and that's fine|-|cuz we already been around five|-|lil weed, hennessy kinda sound nice|-|finna need blue sheets lay around night|-|feeling weak in the knees, make it bounce like blap blap blap|-|bed smack to the wall, tap tap tap|-|wait let me throw it all back back back|-|neighbor banging on the door|-|ain't no sleeping, fuck monday|-|it's a weekend til sunday|-|our moon will be sunlight|-|he like that t-shirt no undies|-|ain't no sleeping, fuck monday|-|it's a weekend til sunday|-|our moon will be sunlight|-|he love that t-shirt no undies|-|let me break it to you boy|-|i can give it to you all night|-|on and on we pullin' all nighters|-|we ain't gotta turn on them lights
13,amala,juicy,i keep it juicy juicy, i eat that lunch (yeah)|-|she keep that booty booty, she keep that plump (yeah yeah)|-|that natural beauty beauty, yeah, yeah|-|if you could see it from the front, wait \'til you see it from the back, back, back, back, back|-|(wait \'til you see it from the...)|-|back, back, yeah, back, back, back|-|(wait \'til you see it from the...)|-|back, back, back, back, back|-|(wait \'til you see it from the...)|-|if you could see it from the front, wait \'til you see it from the back|-|he like the doja and the cat, yeah|-|he like it thick, he like it fat, yeah|-|like to keep him wanting more|-|he ask me, "doja, where you at, huh?"|-|and all them niggas wanna know|-|how long it take to pull my pants up, mmh, mmh, mmh|-|broke a fingernail and then some, mmh|-|tryna squeeze into my true religion denim, mmh, mmh, mmh|-|sell it big, don\'t wanna sell you light|-|i don\'t buy it, where the cellulite?|-|he said the body unbelievable|-|can\'t trust a big butt and a gemini-i-i-i-i|-|i keep it juicy juicy, i eat that lunch (yeah)|-|she keep that booty booty, she keep that plump (yeah yeah)|-|that natural beauty beauty, yeah, yeah|-|if you could see it from the front, wait \'til you see it from the back, back, back, back, back|-|(wait \'til you see it from the...)|-|back, back, yeah, back, back, back|-|(wait \'til you see it from the...)|-|back, back, back, back, back|-|(wait \'til you see it from the...)|-|if you could see it from the front, wait \'til you see it from the back|-|he spend the racks, he in the trap|-|i\'m fit and fat, he live for that|-|okay, he on his knees, attend the mass|-|he beg for that, i bend and snap|-|she keep it juicy just for papi|-|call me buffy with the body|-|i just slipped into my savage and come over like a walkie|-|my fish like takamaki, like a side of me with saké|-|so i put it in my mouth and suck it out like edamame, yeah|-|hourglass|-|coke bottle body, i got that|-|we got time and you\'re right on that|-|when i turn around and touch it, keep your eyes on that, that, that, that, that, that|-|i keep it juicy juicy, i eat that lunch (yeah)|-|she keep that booty booty, she keep that plump (yeah yeah)|-|that natural beauty beauty, yeah, yeah|-|if you could see it from the front, wait \'til you see it from the back, back, back, back, back|-|(wait \'til you see it from the...)|-|back, back, yeah, back, back, back|-|(wait \'til you see it from the...)|-|back, back, back, back, back|-|(wait \'til you see it from the...)|-|if you could see it from the front, wait \'til you see it from the back|-|he like it plump, he need that|-|need the rump and need the thighs, he eat that|-|eat that up, and in the night, he see that|-|in the dark, and in the ride he keep that|-|keep it running, like it plump, he need that|-|need the rump and need the thighs, he eat that|-|eat that up and in the night, he see that|-|in the dark, and in the ride he keep that|-|keep it running|-|i keep it juicy juicy, i eat that lunch (yeah)|-|she keep that booty booty, she keep that plump (yeah yeah)|-|that natural beauty beauty, yeah, yeah|-|if you could see it from the front, wait \'til you see it from the back, back, back, back, back|-|(wait \'til you see it from the...)|-|back, back, yeah, back, back, back|-|(wait \'til you see it from the...)|-|back, back, back, back, back|-|(wait \'til you see it from the...)|-|if you could see it from the front, wait \'til you see it from the back
14,amala,tiatamera,woah, woah, woah...|-|hair grow long like chia|-|money go long like nia|-|i am the big idea|-|my twins big like tia|-|my twins big like tia, tamera (uh, wait)|-|tia, tamera (uh, wait)|-|tia, tamera (uh, wait)|-|tia, tamera|-|hair grow long like chia|-|money go long like nia|-|i am the big idea|-|my twins big like tia|-|my twins big like tia, tamera (uh, wait)|-|tia, tamera (uh, wait)|-|tia, tamera (uh, wait)|-|tia, tamera|-|they said "doja hit so sticky," i said, "thank you very much"|-|bent the whole world over and said, "spank you very much"|-|cheese like pizzeria, have a seat bitch, please, ikea|-|from the westside like maria, i\'m hot like grits, madea|-|beat the pussy up call peta, i rock the boat like aaliyah (ayy)|-|i rock a bob like sia (ayy), doja on deck, bitch, re-up (okay)|-|thick in thigh, thick in the waist|-|thick in the right motherfuckin\' places|-|hits like venus, serena (ayy)|-|he wanna eat up the caesar (ayy)|-|bonita, bonita, bonita (ayy)|-|baby girl needed the wiener (ayy)|-|dug in the guts and i skeet her (ayy)|-|arena, arena, arena (hey)|-|i\'m in the hall, regina|-|i\'m on the wall at genius|-|i am the wiz, the teacher|-|skinny legend like wiz khalifa (woo)|-|hair grow long like chia|-|money go long like nia|-|i am the big idea|-|my twins big like tia|-|my twins big like tia, tamera (uh, wait)|-|tia, tamera (uh, wait)|-|tia, tamera (uh, wait)|-|tia, tamera|-|hair grow long like chia|-|money go long like nia|-|i am the big idea|-|my twins big like tia|-|my twins big like tia, tamera (uh, wait)|-|tia, tamera (rico, uh, wait)|-|tia, tamera (rico, uh, wait)|-|tia, tamera|-|they said, "rico, you so nasty," i said, "thank you very much" (yeah)|-|he just wanna eat me like some candy, but i\'m not his buttercup|-|these hoes swear that they can\'t stand me, but ain\'t never pullin\' up (um)|-|i just made a hundred k in two weeks, lil\' bitch, do you need me to pull it up? (duh)|-|big black trucks and we pullin\' up (bitch)|-|she drank so much, now she throwin\' it up|-|but we don\'t give a fuck, we still rollin\' it up|-|i got a lot of money, but a lot ain\'t enough|-|park where i want, they ain\'t towin\' us (bitch)|-|i-i make the jokes, you ain\'t trollin\' us (bitch)|-|my neck is on ice, you ain\'t cold as us|-|and when we hop out, yeah, you know it\'s us|-|my-my chopper sing like sia (sia)|-|make a bitch sick, diarrhea (ew)|-|dressed in all black, grim reaper (bitch)|-|don\'t act like you can\'t see us (yeah)|-|ride-ridin\' in a foreign, no prius|-|he keep callin\' my phone, nokia|-|so i put the nigga on speaker|-|if you got a problem, better speak up|-|hair grow long like chia|-|money go long like nia|-|i am the big idea|-|my twins big like tia|-|my twins big like tia, tamera (uh, wait)|-|tia, tamera (uh, wait)|-|tia, tamera (uh, wait)|-|tia, tamera|-|hair grow long like chia|-|money go long like nia|-|i am the big idea|-|my twins big like tia|-|my twins big like tia, tamera (uh, wait)|-|tia, tamera (uh, wait)|-|tia, tamera (uh, wait)|-|tia, tamera
15,amala,mooo,(moo, moo, moo, moo, moo, moo, moo, mooooo)|-|(moo, moo, moo, moo, moo, moo, moo, mooooo)|-|yeah|-|bitch, i\'m a cow, bitch, i\'m a cow|-|i\'m not a cat, i don\'t say meow|-|bitch, i\'m a cow, bitch, i\'m a cow|-|bitch, i\'m a cow, bitch, i\'m a cow|-|i go "mooo" (i\'m a cow, i\'m a cow, i\'m a cow)|-|mooo (i\'m a cow, i\'m a cow, i\'m a cow, i\'m a cow)|-|mooo (i\'m a cow, i\'m a cow, i\'m a cow, i\'m a cow)|-|mooo (i\'m a cow, i\'m a cow, i\'m a cow, i\'m a cow)|-|yeah, i say, bitch, i\'m too smooth|-|i\'m not in the mood|-|tryna make moves|-|tryna make moves|-|bitch, i\'m too smooth|-|i\'m not in the mood|-|tryna make moves|-|tryna make moves|-|got milk, bitch? got beef? (got beef?)|-|got steak, ho? got cheese? (got it)|-|grade a ho, not lean (not lean)|-|got me a1, sauce please|-|these heifers got nothin\' on me|-|steaks high, need a side of collard greens|-|cash rules everything around me (everything around me)|-|ice c.r.e.a.m, ice c.r.e.a.m (ice cream)|-|you a calf, bitch, you my daughter (you my daughter)|-|i ain\'t bothered (i ain\'t bothered) get slaughtered (get slaughtered)|-|got the methane, i\'m a farter (woo)|-|with my farmer (woo) mcdonald (woo)|-|and they feed me real good, it\'s a honor (it\'s a honor)|-|philly cheesesteak all in that order (in that order)|-|chili cheese fries as a starter (as a starter)|-|got the steroids keeping me stronger (strong)|-|bitch, i\'m a cow, bitch, i\'m a cow|-|i\'m not a cat, i don\'t say meow|-|bitch, i\'m a cow, bitch, i\'m a cow|-|bitch, i\'m a cow, bitch, i\'m a cow|-|i go "mooo" (moo, moo, moo)|-|mooo (moo, moo, moo, mooooo)|-|mooo|-|mooo (yeah)|-|i say, bitch, i\'m too smooth|-|i\'m not in the mood|-|tryna make moves|-|tryna make moves|-|bitch, i\'m too smooth|-|i\'m not in the mood|-|tryna make moves|-|tryna make moves|-|bitch, i\'m a cow, bitch, i\'m a cow (moo, moo, moo)|-|bitch, i\'m a cow, bitch, i\'m a cow (moo, moo, moo, mooooo)|-|bitch, i\'m a cow, bitch, i\'m a cow|-|bitch, i\'m a cow, bitch, i\'m a cow|-|bitch, i\'m a cow, bitch, i\'m a cow (moo, moo, moo)|-|bitch, i\'m a cow, bitch, i\'m a cow (moo, moo, moo, mooooo)|-|bitch, i\'m a cow, bitch, i\'m a cow|-|bitch, i\'m a cow (yeah) bitch, i\'m a cow|-|old mcdonald had a farm|-|i give him a titty, tryna keep him calm|-|i\'m just tryna turn up in the country|-|i ain\'t in the city cause they ain\'t got lawns|-|suck a nigga dick or somethin\', e-i-o|-|shittin\' on these bitches only thing i know|-|tippin\' on his dick, i see the chickens and the pigs|-|they wanna catch us ridin\' dirty with them fiends, i know|-|i ain\'t a moose, bitch, get out my hay|-|get out my hay, bitch, get out my hay|-|i ain\'t a moose, bitch, get out my hay|-|get out my hay, bitch, get out my hay|-|i ain\'t a moose, bitch, get out my hay|-|get out my hay, get out my hay|-|i ain\'t a moose, bitch, get out my hay|-|get out my hay, bitch, get out my hay|-|milkshake brings all the boys to the farm|-|and they\'re like, it\'s better than yours|-|damn right, it\'s better than yours|-|i can treat you, but i have to charge|-|my milkshake brings all the boys to the farm|-|and they\'re like, it\'s better than yours|-|damn right, it\'s better than yours|-|i can treat you, but i have to charge|-|it\'s better than yours (hey, hey, hey, hey)|-|it\'s better than yours (hey, hey, hey, hey)|-|but i have to charge (hey, hey, hey, hey)|-|come on|-|(hey, hey, hey, hey)|-|it\'s better than yours (hey, hey, hey, hey)|-|it\'s better than yours (hey, hey, hey, hey)|-|but i have to charge (hey, hey, hey, hey)|-|(hey, hey, hey, hey)|-|i want a cheeseburger, fucking vegans!
16,hotpink,cybersex,i wanna touch on you (on you)|-|you see me in my room (my room)|-|wish you were here right now (right now)|-|all of the things i'd do|-|i wanna get freaky on camera|-|i love when we get freaky on camera|-|we freak on the cam|-|love at first sight, just a link to the 'gram|-|pussy all pink with a tan|-|and i play with it 'til my middle fingers are cramped up|-|swipe right 'cause he thick and he handsome|-|love a sneak peek when you free, can we cam up?|-|no shot to the screen, put your hands up|-|make it pop in your face like a samsung|-|and that's my nigga, better yet, that's my hitta|-|he don't leak nudes and if you do you could go missin'|-|met him on tinder, he just swipe left on bitches|-|and he don't even scroll through insta'|-|'less he going through my pictures|-|i wanna touch on you (on you)|-|you see me in my room (my room)|-|wish you were here right now (right now)|-|all of the things i'd do|-|i wanna get freaky on camera|-|i love when we get freaky on camera|-|is you into that? (into that, is you into that? uh-uh)|-|let's break the internet (internet, on the internet, oh-oh)|-|we do it the best (it the best, doin' it the best, uh-uh)|-|when we have cybersex (cybersex, havin' cybersex, oh-oh)|-|when he off work, he calling me on skype (yeah)|-|trust me when i meet him, i'm fucking him on sight (yeah)|-|lemme see you beat it, i'm feelin just like mike (okay, okay)|-|huh, oh, stuff that 'til i drown in all of your pics|-|can't scroll down cause some of them dicks (ya)|-|nigga, my parents going through my shit (my shit, my shit)|-|huh, oh, can't give head, you give me the facetime|-|nigga, you a creep, i saw you on dateline|-|you ain't gettin pussy, you fucking a ai|-|huh, oh, what a time to be alive|-|living in the future, blinging on my hotline|-|i wanna touch on you (on you)|-|you see me in my room (my room)|-|wish you were here right now (right now)|-|all of the things i'd do|-|i wanna get freaky on camera|-|i love when we get freaky on camera|-|i wanna touch on you (on you)|-|you see me in my room (my room)|-|wish you were here right now (right now)|-|all of the things i'd do|-|i wanna get freaky on camera|-|i love when we get freaky on camera|-|is you into that? (into that, is you into that? uh-uh)|-|let's break the internet (internet, on the internet, oh-oh)|-|we do it the best (it the best, doin' it the best, uh-uh)|-|when we have cybersex (cybersex, havin' cybersex, oh-oh)
17,hotpink,wontbite,le-le-le-le-ha-yeah|-|le-le-le-le-ha-yeah|-|le-le-le-le-ha-yeah|-|le-le-le-le-ha-yeah|-|yeah, yeah|-|le-le-le-le-ha-yeah|-|le-le-le-le-ha-yeah|-|le-le-le-le-ha|-|closer to me, baby, i won\'t bite|-|you look so tasty, but i won\'t bite, really|-|i\'m such a good kitty, don\'t put up fights|-|but if you trick me, baby, it gon\' get sticky|-|i might (might just), bite (i might just)|-|i might (i might just), bite (i might just)|-|i might (i might just), bite (i might just)|-|i might (i might just), bite (i might just)|-|i might|-|i, i, i might just rip a nigga head off if|-|he just wanna hit and head off, then|-|why the fuck you in my bed all day?|-|talking \'bout you getting bread|-|\'less you is a bird, then i understand, okay|-|never ever bite the hand feeding you the worm|-|these are not your eggs, okay, look, look, look|-|long ass money with a short fuse|-|i\'m 5\'3", but i\'ll make that nigga 4\'2"|-|if you wanna do it, motherfucker, i won\'t stop you (yeah, yeah)|-|do it, motherfucker, i won\'t stop you, ooh|-|closer to me, baby, i won\'t bite|-|you look so tasty, but i won\'t bite, really|-|i\'m such a good kitty, don\'t put up fights|-|but if you trick me, baby, it gon\' get sticky|-|i might (might just), bite (i might just)|-|i might (i might just), bite (i might just)|-|i might (i might just), bite (i might just)|-|i might (i might just), bite (i might just)|-|i might|-|le-le-le-le-le-le-le-le-le-le-ha|-|le-le-le-le-le-le-le-le-le-le-ha|-|le-le-le-le-le-le-le-le-le-le-ha|-|don\'t be (nah)|-|sorry, i\'ll be carefree (i\'ll)|-|serve your ass like jeffrey (plug)|-|do it for the glory (wow)|-|late to the shift, be sweet|-|kept my voice high c and i let my braids drop|-|don\'t give a fuck who see|-|nigga d-e-f \'bout to throw grenades (grenades)|-|keep a ghetto freak, but she lightin\' sage|-|natural hair poppin\', don\'t ever get it twisted|-|she at your scalp for the fame|-|nah, nah, nah, nigga, listen, let me lecture, see|-|when it be about the bread, oh, want the quiznos, don\'t test it, ayy|-|i\'m a gentleman, i turn to a barracuda swimming in your blessings, hey|-|higher than a hallelujah, hot as halitosis, she lick me like|-|(la, la la la, la la la, la la la, la)|-|closer to me, baby, i won\'t bite|-|you look so tasty, but i won\'t bite, really|-|i\'m such a good kitty, don\'t put up fights|-|but if you trick me, baby, it gon\' get sticky|-|i might (might just), bite (i might just)|-|i might (i might just), bite (i might just)|-|i might (i might just), bite (i might just)|-|i might (i might just), bite (i might just)|-|i might|-|le-le-le-le-le-le-le-le-le-le-ha|-|le-le-le-le-le-le-le-le-le-le-ha|-|le-le-le-le-le-le-le-le-le-le-ha|-|le-le-le-le-le-le-le-le-le-le-ha|-|le-le-le-le-le-le-le-le-le-le-ha|-|le-le-le-le-le-le-le-le-le-le-ha|-|le-le-le-le-le-le-le-le-le-le-ha|-|le-le-le-le-le-le-le
18,hotpink,rules,said play with my pussy but don't play with my emotions|-|if you spend some money then maybe i just might fuck you|-|when i shake that ass i'ma do this shit in slow motion|-|you got a whole lotta cash then nigga, you know i want it|-|play with my pussy but don't play with my emotions|-|if you spend some money then maybe i just might fuck you|-|when i shake that ass i'ma do this shit in slow motion|-|you got a whole lotta cash then nigga, you know i want it|-|break some bread, oh nigga, that butter my biscuit|-|you ain't talk money, then really that's none of my business|-|i don't even need these lenses|-|20 on 20 my vision|-|bad yellow bitch with her eye on the prize|-|but nigga, i ain't no minion|-|millions, thousands, billions|-|bobs on me like dylan|-|blondes on me like hilton|-|wendies on me like williams|-|shouting, digging|-|look at me like i'm alien|-|bitch, i'm fucking reptilian|-|bitch, bitch, ah|-|all y'all bitches was wrong|-|talkin' 'bout i fell off|-|you ain't even get on|-|bitch, bitch, yah|-|all y'all bitches is precious|-|wait, i meant to say jealous|-|all y'all bitches is jealous|-|bitch, bitch|-|said play with my pussy but don't play with my emotions|-|if you spend some money then maybe i just might fuck you|-|when i shake that ass i'ma do this shit in slow motion|-|you got a whole lotta cash then nigga, you know i want it|-|play with my pussy but don't play with my emotions|-|if you spend some money then maybe i just might fuck you|-|when i shake that ass i'ma do this shit in slow motion|-|you got a whole lotta cash then nigga, you know i want it|-|(and now you playin' with my emotions)|-|nigga, don't do it, you blew it|-|you tryna cast spells on a bitch with potions|-|nigga, i need devotion|-|(i'm leaving you with that lotion)|-|tellin' me this and that, the third|-|that shit for the birds, i'm ghosting|-|if you don't dive in that pussy like dolphins|-|if you don't dive in that pussy like oceans|-|twins look identically like olsens|-|nigga don't hide from that pussy, be open|-|nigga want spy on that pussy like austin|-|(do i make you horny baby)|-|that's my ego that you stroking nigga|-|don't laugh, 'cause that pussy ain't joking nigga|-|don't splash when the pussy be soaking|-|where that nigga who don't play mind games at?|-|you got a fake gold chain on, change that|-|tryna spit game while i'm on my way out, late-ass|-|where that nigga man, where he at? where he at?|-|said play with my pussy but don't play with my emotions|-|if you spend some money then maybe i just might fuck you|-|when i shake that ass i'ma do this shit in slow motion|-|you got a whole lotta cash then nigga, you know i want it|-|play with my pussy but don't play with my emotions|-|if you spend some money then maybe i just might fuck you|-|when i shake that ass i'ma do this shit in slow motion|-|you got a whole lotta cash then nigga, you know i want it
19,hotpink,bottombitch,ooh, that's my trick|-|i'm her pimp, she my flip|-|ooh, don't forget, that's my trick|-|she my bottom bitch|-|ooh, that's my trick|-|i'm her pimp, she my flip|-|ooh, don't forget, that's my trick|-|she my bottom bitch|-|that's my hoe|-|that's my doe|-|that's my glow up|-|she go hard, she just like a pro|-|she just wanna blow up|-|if you talkin' shit|-|wipe your spit of my nuts, nigga grow up|-|on the boat like i'm noah|-|on xan like i'm noah|-|damn i don't know her no more|-|and she buy the crib|-|then she buy the whip|-|in a prada fit|-|got some gucci kicks|-|that's my bottom bitch|-|'cause she bout it bitch|-|and i'm proud of it|-|ooh, that's my trick|-|i'm her pimp, she my flip|-|ooh, don't forget, that's my trick|-|she my bottom bitch|-|ooh, that's my trick|-|i'm her pimp, she my flip|-|ooh, don't forget, that's my trick|-|she my bottom bitch|-|she don't create no problems|-|that's why the bitch my bottom|-|and she look like model, ooh|-|she ain't no rat, she possum|-|all up in that concoction|-|personal coochie popper, ooh|-|slip into something pretty|-|i need to be this faded|-|baby gon' get her way, ooh|-|baby, don't keep me waiting|-|baby boy, what you paying?|-|drop it and i ain't gon' stay with y'all|-|'cause i know what you want|-|don't lie (don't lie)|-|you want something for one night|-|ooh, that's my trick|-|i'm her pimp, she my flip|-|ooh, don't forget, that's my trick|-|she my bottom bitch|-|ooh, that's my trick|-|i'm her pimp, she my flip|-|ooh, don't forget, that's my trick|-|she my bottom bitch|-|ooh, that's my trick|-|i'm her pimp, she my flip|-|ooh, don't forget, that's my trick|-|my bottom bitch|-|ooh, that's my trick|-|i'm her pimp, she my flip|-|ooh, don't forget, that's my trick|-|my bottom bitch|-|ooh|-|ooh|-|ooh
