index,album,song,lyrics
29,planether,naked,baby, you're so anxious|-|you can't take it|-|can we take this off and get naked?|-|can we take this off and get naked?|-|can we take this off and get nake—?|-|baby, you're so anxious|-|you can't take it|-|can we take this off and get naked?|-|can we take this off and get naked?|-|can we take this off and get naked? ah|-|i don't think 'bout anybody|-|but bein' beside your body, baby (la-la-la-la-la, la, la-la-la, la-la-la-la-la-la-la)|-|you can leave open windows|-|don't care who see me out my clothes, baby|-|yeah, i like bananas and peaches|-|and some might say it's indecent|-|that's just crazy (that's just crazy)|-|can i slide outta mine and into yours?|-|heels on, waitin' at your door|-|i don't wanna play no more|-|leave everything on the floor|-|you don't need a pole to see me strip|-|only thing i want is to taste your lips|-|take it to the top, boy, skinny dip|-|(so hot, your body on mine, your body on)|-|i don't even wanna get a grip|-|i just like it when you grab my hips|-|can you feel it through your fingertips?|-|how do i keep this on?|-|how do i let you know?|-|boy, you deserve a show|-|deserve to get comfortable|-|it's only natural|-|i could tell when you locked the door|-|just what was going on|-|boy, can we take off all our clothes?|-|when can we take off all our clothes?|-|when can we take off all our clothes?|-|when can we take off all our clothes?|-|baby, you're so anxious|-|you can't take it|-|can we take this off and get naked?|-|can we take this off and get naked?|-|can we take this off and get nake—?|-|baby, you're so anxious|-|you can't take it|-|can we take this off and get naked?|-|can we take this off and get naked?|-|can we take this off and get naked? ah|-|follow me to my dressin' room|-|let me know if you ain't 'bout that nsfw|-|now it's safe to finish what we started|-|first impression of you is you really like to party|-|swirlin' all up on you 'cause you know i wanna dancin'|-|let me cordially invite you to this party in my pants|-|how you got me sprung and don't say sorry in advance|-|show me all your tats, not just the ones that's on your hands|-|who's your designer?|-|is that birthday suit one of a kind, uh?|-|everythin' about you look like it's on purpose|-|god was workin', probably took some extra time though|-|ayy, all up in my curves like a puzzle piece, mmm|-|dick is hard, let me see your muscle spasms, mmm|-|after we fuck, i'ma wanna cuddle|-|we could take it to the kitchen|-|i'll be on the island, come and eat, mmm|-|how do i keep this on?|-|how do i let you know?|-|boy, you deserve a show|-|deserve to get comfortable|-|it's only natural|-|i could tell when you locked the door|-|just what was going on|-|boy, can we take off all our clothes?|-|(anxious, you can't take it)|-|(can we take this off and get naked?)|-|when can we take off all our clothes?|-|(can we take this off and get naked?)|-|(can we take this off and get naked?)|-|when can we take off all our clothes?|-|(feelin' so anxious, can't take it)|-|(can we take this off and get naked?)|-|when can we take off all our clothes?|-|(can we take this off and get naked?)|-|(can we take this off and get naked? ah)|-|touchin', touch my body|-|just touchin', touch my body|-|just touch me|-|ayy, touch my body, just|-|(touch me, touch me)|-|yeah, touchin', touch my body|-|just touchin', touch my body|-|just touch me|-|uh, touch my body, yeah|-|touch me, baby|-|(touchin', touch my body)|-|(just touch me, touch me, baby, yeah)|-|(touch you, touch my body, just)
30,planether,payday,all this money on me (me)|-|it don\'t mean nothing (\'thing)|-|see it in your dreams|-|i just spend it all on my team, and we go|-|oh-yeah, yeah, yeah|-|getting paid e\'e\'yday, yeah|-|we\'re just getting by (by)|-|savin\' on the side (side)|-|i just can\'t believe|-|i got what i wanted all my life, now we go|-|oh-yeah, yeah, yeah|-|getting paid e\'e\'yday, yeah|-|said, everything that i want (yeah)|-|i don\'t need it, i got it already|-|tell me what you want, uh|-|point to it, i got you baby, get it, uh|-|i just keep drippin\' like a fuckin\' mermaid, yeah|-|and drop a band to keep the smile on that face, yeah|-|and i\'m bilingual, talking money conversations|-|and, baby, we are not the same, make no mistakes, yeah (make no mistakes)|-|you gotta face it (you gotta face)|-|\'cause i just keep addin\' up and they run it up|-|and then add it up, and they run it, run it|-|all this money on me (me)|-|it don\'t mean nothing (\'thing)|-|see it in your dreams|-|i just spend it all on my team, and we go|-|oh-yeah, yeah, yeah|-|getting paid e\'e\'yday, yeah|-|we\'re just getting by (by)|-|savin\' on the side (side)|-|i just can\'t believe|-|i got what i wanted all my life, now we go|-|oh-yeah, yeah, yeah|-|getting paid e\'e\'yday, yeah|-|i be waitin\' outside (yeah)|-|i be waitin\' outside (yeah)|-|i don\'t care \'bout vibes, baby, set that shit aside (yeah)|-|all your momma physics, tell me you gon\' blossom right (oh, yeah, yeah, yeah, yeah)|-|and your daddy gotta fuck, jumpin\' on, ready to ride (skrrt)|-|i just wanted to love you, baby, tell me what you needin\'|-|i don\'t fuck with rascals for a reason (for a reason)|-|i done dropped your problem down, yeah, i see that (oh, yeah, yeah, yeah, yeah)|-|bring my fuckin\' mistress \'fore i swing it like serena|-|and i know you feel my vibe, i\'ma love you \'til we die|-|patek on my wrist, okay, it must be perfect timing|-|she like, "yeah, yeah, yeah, ayy-ayy|-|yeah, yeah, yeah-yeah-yeah"|-|i wan\' see, baby, let me see (woah)|-|hope you wanna fuck \'cause my money long like limousine|-|yeah, yeah, yeah, yeah-yeah, yeah (oh, yeah, yeah, yeah, yeah)|-|and i\'m bilingual, talking money conversations|-|and, baby, we are not the same, make no mistakes, yeah (make no mistakes)|-|you gotta face it (you gotta face)|-|\'cause i just keep addin\' up and they run it up|-|and then add it up, and they run it, run it|-|all this money on me (me)|-|it don\'t mean nothing (\'thing)|-|see it in your dreams|-|i just spend it all on my team, and we go|-|oh-yeah, yeah, yeah|-|getting paid e\'e\'yday, yeah|-|we\'re just getting by (by)|-|savin\' on the side (side)|-|i just can\'t believe|-|i got what i wanted all my life, now we go|-|oh-yeah, yeah, yeah|-|getting paid e\'e\'yday, yeah|-|all this money on me (me)|-|it don\'t mean nothing (\'thing)|-|see it in your dreams|-|i just spend it all on my team, and we go|-|oh-yeah, yeah, yeah|-|getting paid e\'e\'yday, yeah|-|we\'re just getting by (by)|-|savin\' on the side (side)|-|i just can\'t believe|-|i got what i wanted all my life, now we go|-|oh-yeah, yeah, yeah|-|getting paid e\'e\'yday, yeah
31,planether,getintoityuh,yeah, ayy|-|ha, ayy, yeah|-|they say i just got a buck, uh|-|get into it, yuh|-|pop out with a truck, ha|-|get into it, yuh (yuh)|-|if you go to church|-|i said get into it, yuh|-|if she ain\'t got a butt|-|nah, fuck it, get into it, yuh|-|and i say i just got a buck|-|get into it, yuh|-|pop out with a truck|-|get into it, yuh|-|if you go to church|-|get into it, yuh|-|if she ain\'t got a butt|-|fuck it, get into it, yuh|-|yeah, you just wanna party, you just wanna lap dance|-|you just wanna pop up on these clowns like you\'re the batman|-|you just wanna ball out in designer with your best friends|-|you don\'t wanna talk no more about it in the past tense|-|get me out my zone, i\'m just talkin\' comfort, shawty|-|i ain\'t give you nothin\' you could come for, shawty|-|i got plenty things you make a run for, shawty|-|call him ed sheeran, he in love with my body|-|they say i just got a buck, uh|-|get into it, yuh|-|pop out with a truck, ha|-|get into it, yuh (yuh)|-|if you go to church|-|i said get into it, yuh|-|if she ain\'t got a butt|-|nah, fuck it, get into it, yuh|-|and i say i just got a buck|-|get into it, yuh|-|pop out with a truck|-|get into it, yuh|-|if you go to church|-|get into it, yuh|-|if she ain\'t got a butt|-|fuck it, get into it, yuh|-|y\'all need to get into the drip like a piranha|-|y\'all need to get into my drip like y\'all need water|-|i mean, it\'s only head to toe balenciaga|-|i mean, y\'all bitches better "yuh" like ariana|-|if they ever tryna knock her, put my foot up in your caca|-|call your mama and your papa like i\'m finna take your daughter|-|turn that bitch into a soccer ball and rocka, rocka, rocka (brrr)|-|get into it like a suit and fuck a stock up like a broker|-|they say i just got a buck (yuh)|-|get into it, yuh (ayy)|-|pop out with a truck, ha|-|get into it, yuh (pop out, pop out)|-|if you go to church|-|i said get into it, yuh|-|if she ain\'t got a butt|-|nah, fuck it, get into it, yuh|-|and i say i just got a buck (ayy)|-|get into it, yuh|-|pop out with a truck|-|get into it, yuh (yeah)|-|if you go to church|-|get into it, yuh (go to church)|-|if she ain\'t got a butt|-|fuck it, get into it, yuh|-|(yeah, yeah, yeah, yeah)|-|thank you, nicki, i love you|-|got that big rocket launcher!
32,planether,needtoknow,wanna know what it\'s like (like)|-|baby, show me what it\'s like (like)|-|i don\'t really got no type (type)|-|i just wanna fuck all night|-|yeah-yeah, oh-whoa-whoa (oh, ooh, mm)|-|baby, i need to know, mm (yeah, need to know)|-|i just been fantasizin\' (size)|-|and we got a lotta time (time)|-|baby, come throw the pipe (pipe)|-|gotta know what it\'s like (like)|-|yeah-yeah, oh-whoa-whoa|-|baby, i need to know, mm|-|what\'s your size? (size)|-|add, subtract, divide (\'vide)|-|daddy don\'t throw no curves (curves)|-|hold up, i\'m goin\' wide (wide)|-|we could just start at ten (ten)|-|then we can go to five (five)|-|i don\'t play with my pen (pen)|-|i mean what i write|-|yeah-yeah, whoa-whoa-whoa|-|i just can\'t help but be sexual (oh)|-|tell me your schedule (yeah)|-|i got a lotta new tricks for you, baby|-|just sayin\' i\'m flexible (i will)|-|i do what i can to get you off (i will)|-|might just fuck him with my makeup on (i will)|-|eat it like i need an apron on (you okay?)|-|eat it \'til i need to change my thong (you okay?)|-|we could do it to your favorite song (you okay?)|-|take a ride into the danger zone|-|you know my nigga be buggin\' me|-|i just be wonderin\' if you can fuck on me better|-|itchin\' for me like an ugly sweater|-|need it in me like a chuck e. need cheddar|-|i need to know|-|wanna know what it\'s like (like)|-|baby, show me what it\'s like (like)|-|i don\'t really got no type (type)|-|i just wanna fuck all night|-|yeah-yeah, oh-whoa-whoa (oh, ooh, mm)|-|baby, i need to know, mm (yeah, need to know)|-|i just been fantasizin\' (size)|-|and we got a lotta time (time)|-|baby, come throw the pipe (pipe)|-|gotta know what it\'s like (like)|-|yeah-yeah, oh-whoa-whoa|-|baby, i need to know, mm|-|you\'re exciting, boy, come find me|-|your eyes told me, "girl, come ride me"|-|fuck that feeling both us fighting|-|could he try me? (yeah) mm, most likely|-|tryna see if you could handle this ass|-|prolly give his ass a panic attack|-|sorry if i gave a random erection|-|prolly thinkin\' i\'m a telekinetic|-|oh, wait, you a fan of the magic?|-|poof, pussy like an alakazam|-|i heard from a friend of a friend|-|that that dick was a ten out of ten|-|i can\'t stand it, just one night me|-|clink with the drink, gimme a sip|-|tell me what\'s your kink, gimme the dick|-|spank me, slap me, choke me, bite me (ew)|-|oh, wait, i can take it (ah)|-|give a fuck \'bout what your wifey\'s sayin\' (yeah)|-|wanna know what it\'s like (like)|-|baby, show me what it\'s like (like)|-|i don\'t really got no type (type)|-|i just wanna fuck all night|-|yeah-yeah, oh-whoa-whoa (oh, ooh, mm)|-|baby, i need to know, mm (yeah, need to know)|-|i just been fantasizin\' (size)|-|and we got a lotta time (time)|-|baby, come throw the pipe (pipe)|-|gotta know what it\'s like (like)|-|yeah-yeah, oh-whoa-whoa|-|baby, i need to know, mm
33,planether,idontdodrugs,love got me fucked up|-|got me on stuck, chasin' that rush|-|had to give in, couldn't give up|-|i just want you, but i don't do drugs|-|still i want you, ooh-ooh|-|ooh, ooh-ooh|-|ooh, ooh-ooh|-|ooh|-|all i want is you, ooh-ooh|-|ooh, ooh-ooh|-|ooh, ooh-ooh|-|ooh|-|baby, i've been in my bag|-|you don't really hit me back|-|'cause i feel like i'm attached|-|shoulda never kissed you back|-|ever since i fell in love|-|not quite like bein' trapped|-|more like a sickness that|-|keeps me addicted bad|-|hard for me to let you go (let you go, let you go)|-|my body wouldn't let me hide it (hide it)|-|no matter what, i wouldn't fold (wouldn't fold, wouldn't fold)|-|ridin' through the thunder, lightnin'|-|(and i)|-|forgive me, i brought it upon myself|-|(and i)|-|needed a fix of you, not just one kiss from you|-|i needed more|-|love got me fucked up|-|got me on stuck, chasin' that rush|-|had to give in, couldn't give up|-|i just want you, but i don't do drugs|-|still i want you, ooh-ooh (all i want is my baby)|-|ooh, ooh-ooh (all i want is my baby)|-|ooh, ooh-ooh (all i want is my baby)|-|ooh (my baby, my baby)|-|all i want is you, ooh-ooh (all i want is my baby)|-|ooh, ooh-ooh (all i want is my baby)|-|ooh, ooh-ooh (all i want is my baby)|-|ooh (my baby, my baby)|-|tryna stay in my lane|-|i should play on the safe side|-|but you fuckin' me up on this facetime|-|faded, pourin' all over you|-|know exactly what i wanna do|-|so, baby, can you get it from the back?|-|got me purrin' like i'm doja cat|-|keep me in your bag|-|'cause you wanna hear me say i'm comin' back|-|but this time, i want support, just make it last|-|woah-oh (ah)|-|it's hard for me to let you go (let you go)|-|my body wouldn't let me hide it|-|no matter what, i wouldn't fold (wouldn't fold)|-|ridin' through the thunder, lightnin'|-|(and i)|-|forgive me, i brought it upon myself|-|(and i)|-|needed a fix of you, not just one kiss from you|-|i needed more|-|love got me fucked up|-|got me on stuck, chasin' that rush|-|had to give in, couldn't give up (i couldn't give up)|-|i just want you, but i don't do drugs|-|still i want you, ooh-ooh|-|ooh, ooh-ooh (all i want is you, baby)|-|ooh, ooh-ooh (all i want is you)|-|ooh (mmm, ah)|-|all i want is you, ooh-ooh|-|ooh, ooh-ooh (all i really want)|-|ooh, ooh-ooh (is you)|-|ooh (yeah)|-|
34,planether,lovetodream,i know what you mean, you don\'t fuck with randoms|-|i got everything, everything but real love|-|i got in my head, i bet you could get me back out|-|or you could leave me there, \'cause|-|we just love to dream|-|in my fantasy when you woke up, oh|-|it\'s not you, baby, it\'s just me|-|i don\'t believe what i just lost|-|i don\'t want to close my eyes|-|nobody wants to fall (fall), after they did it all (all)|-|i wonder if i left my body there, would i|-|die right in my sleep (sleep) but in reality (\'ty)|-|it could feel like anything is possible|-|when i hear you speak, it really drives it deep|-|woke up in a sweat in the middle of the night|-|it\'s gettin\' under my skin, baby|-|i wouldn\'t wonder why|-|i know what you mean, you don\'t fuck with randoms|-|i got everything, everything but real love|-|i got in my head, i bet you could get me back out|-|or you could leave me there, \'cause|-|we just love to dream|-|in my fantasy when you woke up, oh|-|it\'s not you, baby (na-na-na-na-na), it\'s just me (na-na-na-na-na)|-|i don\'t believe (na-na-na-na-na) what i just lost (na-na-na-na-na)|-|(i say, i say, i say) (na-na-na-na-na)|-|and i say, "ooh, stop it", ayy|-|i look a little like nashe, ayy|-|you look a little exhausted, ayy (yah)|-|we should say no to the party, ayy (huh)|-|take me home in the bugatti, ayy (yahh)|-|hope you like a little tear, put it on his tea|-|that way you have a matcha, ayy|-|jump in bed without my bonnet, ah (my bonnet)|-|take a minute for the finer things (yah)|-|i don\'t even wanna sleep|-|you doin\' some weed, blow it in my china bang|-|i be havin\' hella dreams|-|pickin\' up the sheets feelin\' like a tidal wave|-|hit me if you want it right away|-|if he hit me with the mornin\' signs|-|show up, hit him with apologies|-|kicks on him with a pile of j\'s|-|bricks on him with a dick on him (yo)|-|put a fit on him with the prada shades (prada shades)|-|tits on him and i ride away (ride away)|-|(how much do you want it?) twice a day|-|(four times) on the holidays (yuh)|-|can you come through and your dreams come true|-|and trust me, you won\'t ever fall asleep|-|i know what you mean, you don\'t fuck with randoms (and i hope you)|-|i got everything, everything but real love (and i hope you)|-|i got in my head, i bet you could get me back out (and i hope you)|-|or you could leave me there, \'cause (or leave me there)|-|we just love to dream (and i hope you)|-|in my fantasy (and i hope you) when you woke up, oh (and i hope you)|-|(oh, baby, baby) it\'s not you, baby (na-na-na-na-na), it\'s just me (na-na-na-na-na)|-|i don\'t believe (na-na-na-na-na) what i just lost (na-na-na-na-na)|-|oh-oh
35,planether,youright,i got a man but i want you|-|i got a man but i want you|-|and it's just nerves, it's just dick|-|makin' me think 'bout someone new|-|you know, i got so much to say|-|i try to hide it in my face|-|and it don't work, you see through|-|that i just wanna get with you|-|and you're right|-|you right, i|-|got my guy|-|but i, i|-|can't help it, i want you|-|said, you right, i|-|got my guy|-|but i, i|-|can't help it, i want you|-|i can't stop and look the other way|-|'cause i know what could be, babe|-|and you'd never feel the same|-|you'd be thinkin' 'bout it every day|-|don't believe in fairy tales|-|but we got our fantasies|-|and it's me and you, no she|-|tryna be all through your sheets|-|have you all on top of me|-|actin' like it's not that deep|-|oh, you could take it out on me|-|tell me what it's 'bout to be|-|really feel it's bound to be|-|i can't tell no one but they all know|-|i got a man but i want you|-|i got a man but i want you|-|and it's just nerves, it's just dick|-|makin' me think 'bout someone new|-|you know, i got so much to say|-|i try to hide it in my face|-|and it don't work, you see through|-|that i just wanna get with you|-|and you're right|-|you right, i|-|got my guy|-|but i, i|-|can't help it, i want you|-|said, you right, i|-|got my guy|-|but i, i|-|can't help it, i want you|-|girl, i want you like you want me too|-|i feel that energy|-|when you're on top of me|-|i know your man, he ain't controllin' you|-|but you still hesitate|-|'cause you choose loyalty|-|i know your history|-|met him before your peak|-|he's so connected to that woman that you used to be|-|but-but-but this sex will cloud your memory|-|a couple strokes to put it in then you'll belong to me|-|i got a man but i want you|-|i got a man but i want you|-|and it's just nerves, it's just dick|-|makin' me think 'bout someone new|-|you know, i got so much to say|-|i try to hide it in my face|-|and it don't work, you see through|-|that i just wanna get with you|-|and you're right|-|you right, i|-|got my guy|-|but i, i|-|can't help it, i want you|-|said, you right, i|-|got my guy|-|but i, i|-|can't help it, i want you
36,planether,beenlikethis,since you've been like this|-|baby, i don't really wanna be in like this|-|ever since you've been like this|-|baby, i don't really wanna be in like this|-|see you've been changin', baby|-|in good ways and bad ways|-|can't say what i say, it's far too late|-|nothing can make me, baby|-|made me too nervous|-|cryin' and this hurt and i gotta tell you why|-|since you've been like this (this, this, this)|-|baby, i don't really wanna be in like this (this, this, this)|-|ever since you've been like this (this, this, this)|-|baby, i don't really wanna be in like this (this, this, this)|-|who is frontin', baby?|-|we don't have fun these days|-|it's more than complicated, ah|-|(couldn't say you wasn't with it)|-|told me just stop my mind|-|when you gave up, i tried|-|i gave you all this time|-|gave you my everything|-|said i can do this all night, baby|-|said i was actin' out of line, maybe|-|can't put my trauma to the side|-|when you told me i was lyin', had me feelin' like i died, baby|-|i seen a grown man cry, baby|-|to see you do it, it ain't special, no|-|wonder when i ain't there, what the fuck you've been sayin'|-|talkin' 'bout why i say shit, oh|-|and i know it might mess you up|-|hatin' me ain't gon' get you love|-|ain't nobody gon' set you up|-|i ain't even gon' sweat you, love|-|and we'll never be friends like this|-|god couldn't forgive like this|-|way i really went in like this|-|thank god i ain't been like this (yeah)|-|since you've been like this (this, this, this)|-|baby, i don't really wanna be in like this (this, this, this)|-|ever since you've been like this (this, this, this)|-|baby, i don't really wanna be in like this (this, this, this)|-|since you've been like this|-|i, bless your heart (like this)|-|but i, i can't take no more (like this)|-|i, bless your heart (like this)|-|but i, i can't take no more (like this)|-|since you've been like this|-|baby, i don't really wanna be in like this
37,planether,options,i don\'t need lovin\', late-night cuffin\'|-|take it all off, you naughty|-|put it back on and pause it|-|kitchen island, bedroom, closet|-|takin\' that elsewhere, maybe|-|we know we both got options|-|i know you faded, boy|-|i feel it wearin\' off|-|went to get hen\' and coke|-|i like the way you talk, yeah|-|i couldn\'t give a fuck|-|givin\' him paranoia|-|he just wanna smash on tour|-|fuckin\' for the new velour|-|i like it when you with me all night|-|i can\'t imagine what you might try|-|yeah, you so full of surprises|-|guess you one of my vices|-|you want a picket fence and a wife|-|you never change your mind when i cry|-|yeah, i see your flaws and you know it|-|droppin\' your jaw when the drawers hit the floor|-|i don\'t need lovin\', late-night cuffin\'|-|take it all off, you naughty|-|put it back on and pause it|-|kitchen island, bedroom, closet|-|takin\' that elsewhere, maybe|-|we know we both got options|-|you can count on me|-|to never count on you|-|i\'m only down for you|-|we pretty down, baby, well, i, i|-|she wanna fuck a nigga like she love me|-|she got a lover, but i might get lucky|-|but you got me on a drain like a drunkie|-|lookin\' at the junk in your trunk like a junkie|-|we don\'t speak, just fuck a twice a week|-|and if she like freaks, we must try a threesome|-|do it on the beach, in the sand, let me see sumn\'|-|seashells on the shore, i\'m a beach bum|-|finna eat sumn\' when you come|-|baby, don\'t you wanna let me know?|-|layin\' on my bed like a vegetable|-|lied when you said, "never let me go"|-|just like a pro, you professional|-|stand on your hand \'cause you flexible|-|now she tryna fuck me in the restroom or the parkin\' lot|-|at the restaurant, anywhere, everywhere, anytime, i|-|i don\'t need lovin\', late-night cuffin\'|-|take it all off, you naughty|-|put it back on and pause it|-|kitchen island, bedroom, closet|-|takin\' that elsewhere, maybe|-|we know we both got options|-|i don\'t need lovin\', late-night cuffin\'|-|take it all off, you naughty|-|put it back on and pause it|-|kitchen island, bedroom, closet|-|takin\' that elsewhere, maybe|-|we know we both got options
38,planether,aintshit,man|-|this happened one, two, three times too much|-|these dumb-ass niggas|-|niggas ain't shit|-|come up in your crib|-|all up in your fridge|-|can't pay rent|-|look at what you did|-|listen to your friends|-|when they say|-|niggas ain't shit, cause|-|niggas ain't shit|-|come up in your crib|-|all up in your fridge|-|can't pay rent|-|look at what you did|-|listen to your friends|-|when they say|-|niggas ain't shit|-|umm, you could say that again|-|niggas is square like madison|-|i can't even really get mad at them|-|they fall, then i gotta facepalm|-|shook him like a 8-ball and it's embarrassin'|-|ten-page text, shoulda wrote a book, coulda made a bag|-|but he broke and he still waitin' till i can chill|-|and he really think i'ma get back to him|-|doin' too much, relax a bit|-|actin' like that cause your dad's a bitch|-|must be the way that the planets is|-|must be your face cause it's not your dick|-|i'm a freak, not a masochist|-|shoulda known you had the baddest bitch|-|left on read and can't give head|-|really, you ain't shit, need a laxative|-|niggas ain't shit|-|come up in your crib|-|all up in your fridge|-|can't pay rent|-|look at what you did|-|listen to your friends|-|when they say|-|niggas ain't shit, cause|-|niggas ain't shit|-|come up in your crib|-|all up in your fridge|-|can't pay rent|-|look at what you did|-|listen to your friends|-|when they say|-|niggas ain't shit, cause|-|said that's not cheating|-|if i wasn't with your ass, yo (nah)|-|you kept secrets|-|and your cousin told me that, so (your cousin)|-|logical thinkin'|-|is just something that you lack, so|-|what you even mad for?|-|lookin' like a stick up in your asshole (damn)|-|i'm not your mommy, nigga (what?)|-|find a new hobby, nigga (holy shit)|-|return, yo, 'fore i get picked up|-|your shit's in the lobby, nigga (yes)|-|i'm not gon' key your car (yay)|-|i'll call your fuckin' mom (woo, shit)|-|you should have paid my rent (woo)|-|go get a fuckin' job (job)|-|niggas ain't shit|-|come up in your crib|-|all up in your fridge|-|can't pay rent|-|look at what you did|-|listen to your friends|-|when they say|-|niggas ain't shit, cause|-|niggas ain't shit|-|come up in your crib|-|all up in your fridge|-|can't pay rent|-|look at what you did|-|listen to your friends|-|when they say|-|niggas ain't shit, cause
